id,text,instructions,source_text
65975436BE5C,"True self-esteem dose come from praising someone to keep going and to follow their dream. Like a good friend once said ""never let anyone put you down always get right back up on your feet"". This is saying that people should believe in their self more than what other people say about them that will drag them down. People need to have thick skin to block all the negative haters and disbelievers because having courage, confident, and trust can help with self-esteem.

First, people need to be confident in their self in order to fallow what they want to achieve in life. For example, I was not confident on passing the SOL and my teacher was praising me to be positive and not to over think it. Then it came to the SOL, and when I finished it, the next day my teacher told me that I had passed. She later then told me that I should believe in my self more. This show that when someone praises another person that they will have confidants in their self.

Second, courage can be helpful in over coming fears that can drag one self down. For example, when running a relay race and you start to fall behind. People end up giving up and saying in their head I lost there is no way to catch up because Im all ready in last place. People will want a friend to cheer them up and encourage them not to quit and to keep fighting. From the courage that is given to them then they will keep running till the finish line. This shows that courage can praise someone to keep going.

Finally, many young teens should trust what adults say to them and not ignore them. However, some may say that teens can do what ever they want, they are wrong because teens need to be taught life lessons. For example, when I was younger I steal from stores with a couple of friends. My mother told me not to hang out with other teens that will cause trouble. Which I didnt listen to her and we got caught by the workers and they called our parents to come pay for the belongings we stole. This shows that by praise from adults, teens will make good choices that wont get them punished.

In conclusion, praises can be very helpful for a person to feel good about their self. When taking any kind of test people will want to be successful. To when having to play in a sport people will want to win and not quit. Also to listen to people that are there for others no matter what. This shows that having courage, confident, and trust can help with self-esteem.","
Task: 
1. Research and explore the concept of self-esteem and how it is developed  
2. Investigate the relationship between positive affirmations from others and self-confidence 
3. Examine how courage, confidence, and trust can help build self-esteem 
4. Analyze an example of a situation when an individual was praised and how it motivated that individual to reach a goal  
5. Discuss how adults can provide affirmations to younger individuals and help","
Self-esteem is the foundation for feelings of self-worth and courage, and can be cultivated from positive affirmations provided by others. Studies have shown that we are more likely to reach goals and feel secure when we receive positive affirmations from those around us. Trust in oneself and others can also help to build self-esteem, bolstering confidence and resilience. 

To illustrate, an individual who may have previously felt lack of faith in their ability to complete a task, may receive praise from an adult for their progress thus far. This well-intentioned encouragement can be a large motivator for the individual, as it helps make them feel capable and affirmed in their mission. It also shows that there are people around who believe in them and trust their potential. 
 
Adults have an important opportunity to provide affirmation to younger individuals to support and build self-esteem. Through providing these positive affirmations, adults have the privilege of creating an encouraging atmosphere, a sense of security, and a safe environment to learn and grow."
65B1F548E8BE,"As teen mature, they make opinions about issues that can affect them. Some school offer distance learning as an option for students to attend classes from home by way of online or video conferencing. I think students should not be benefit to attent classes from home.

Students would not be able to socialize with other students. For example, staying home every single day and not going out can lead you to depression. I personnel can't stay home all day and only focus on school. Also, teenagers need to interact with people more often and not be home all day. In conclusion, students need to get out of their home to clear their mind about all the work the school gives them.

Students would not be responsible in the future. For example, when they grow up they will not have the knowledge and the resposability it take to get a job out side of home. Students would not know all the resposabilities it takes to wake up every single day in the morning to go to school and do all the work that is required to do to be able to graduate. In other word, it will affect them not knowing how hard it's to work hard for something they never force them self to do. In conclusion, teenagers should get the experience and the hard work it take to be successful in life at a young age.

While some people believe that students should not be benefit to attend classes from home, others argue that students should be benefit to attend classes from home because they can do their work on their own pace. Althought this might be valid,There is several ideas to considered such as, Students would not be able to experience of being part of a club or sport in school. For example, Schools have many activies that can be helpful for students futher in life. Students will not know how it feel to be part of a team or how to work as a team. Also, In the furure sometimes they will be required to work with a group of people but they will not be comfortable because they never had that experience. In conclusion, Students wouldn't be able to do any activies in school.

Students shouldn't be allow to take classes at home while other student's go to school. First, Students will be isolated in their home all the time. Secondly, They will not know the hard work they need to put in to achieve something. Finally, Students wouldn't be able to enjoy the life of a teenager. As a result, Do you think it will help student's in the future?","
Task: Research the pros and cons of students attending classes from home. Consider the effects it can have on socialization, responsibility, and experience. Provide an opinion on the effects of distance learning on students in the future.","
Recent studies on the effects of distance learning on students' learning outcomes have shown both pros and cons. On one hand, students who attend classes from home are able to learn in an environment that is tailored to their own individual learning styles. This can provide a more engaging learning experience compared to traditional classrooms, as students are in charge of their own learning pace and environment. 

However, students attending classes from home can suffer from issues concerning socialization, responsibility, and experience. Without face-to-face communication, many important learning and life skills such as team work, public speaking, and interpersonal communication are lost. Also, there is comparatively a lack of responsibility and guidance for progress when in an online setting.

Overall, the future of distance learning for students remains, at the very least, uncertain. For those who struggle to learn in a traditional setting, distance learning can provide a great alternative. Equally, traditional classrooms are still preferred by some for a number of reasons, such as social connection and assessment feedback. It is important that students are given the option to choose between the two learning methods in order to create an ideal learning environment."
65B7FDE783F2,"I am student for Generic_School,I have work after school finish school in go to Mai work is all day finish fast. I work four day for week is,I need finish high school in go to fiend university in finish four years. in open businesses for Mai self in work in nether people in make money in big businesses open nether place.

student for steal high school what he do,in work four day for week is need work in model extending the school,he need perk for he life,he ask neither people how time up for life he no how work four day for week in he school each day in he life in finish high school in go fiend good work or job. he need make money for he life in horizon he need merit or hoes in car he need life good or happy.

I think each school or work for school good for you life for horizon school help you how think finish high school in go university in go work after class is help your self for make money help for life in think businesses if you need businesses man is high money bet you steel need stated how work businesses,open businesses for Mai self in work in nether people in make money in big businesses open nether place, he life in horizon he need merit or hoes in car he need life good or happy. in think nether world, open schools nether place in help people is no have money,help for fiend work. in stop fight country in kill people in Chang world for good in life help people what need home or food anther need.

I think each school or work for school good for you life for horizon school help you how think finish high school in go university. bet Chang preview the text, be student he work in school he cant high money in takes he cant buy hoes in Gus for he car in finish high school he need go to university in buy class in room he lief in food in finish university,he need work or job. he need make money for he life in horizon he need merit or hoes in car he need life good or happy. he no how work four day for week in help people. how think finish high school in go university in go work after class is help your self for make money help for life in think businesses if you need businesses man is high money bet you steel need stated how work businesses,slued for businesses man how work in thinking in take people take neither businesses man help to gather. I think all school need money for help student study very good for finish high school in go university what he do math sines he client finish university in go work in make money in good life.","
Task: 

Research the role of education in improving individual and global economic and social outcomes. Consider the different ways that individuals can access higher education, and the potential impacts of different techniques. Investigate examples of educational efforts that have been successful in promoting economic development or reducing poverty. Examine the ways that students can raise the financial resources to attend college and what policies could be implemented to make higher education more accessible.  Analyze the potential for people to use education to build businesses and increase","
Education has a profound impact on both individual economic and social outcomes and global economic and social conditions. Education can provide individuals with opportunities to develop the skills and knowledge necessary to succeed in the workforce, thereby improving their individual economic prospects. It can also empower people to have a greater voice in their communities and participate more fully in their societies. Additionally, education can have a positive impact on global economic and social outcomes by creating a more educated and productive workforce.

When it comes to accessing higher education, there are a number of different approaches. Governments can offer student loans, scholarships, and grants to make higher education more accessible. Private companies, nonprofits, and other organizations can also step in to provide financing for students or establish scholarships for underserved communities. Additionally, students can use crowdfunding to raise money for their educations, or take on part-time or full-time jobs to cover tuition costs.

There are many examples of educational efforts that have been successful in promoting economic development or reducing poverty. For instance, in India, the government launched a program to provide free laptops and internet access to economically disadvantaged students, which has resulted in a reduction in poverty in the region. In Tanzania, a program to train teachers in the use of technology has enabled students to access online courses and educational resources that otherwise would not have been available.

In order to make higher education more accessible, governments and other organizations need to create policies and programs that focus on reducing the financial barriers that prevent individuals from attending college. This could include providing more financial aid, expanding student loan and grant programs, and providing tax credits to those who pay tuition. Additionally, more needs to be done to fund and support initiatives that help students access the resources they need to complete their education. 

Finally, education can be used as a tool to create economic opportunities for people. Individuals can use their education to start businesses and develop products that will benefit their communities and economies. Education can also help to increase the productivity of businesses, as workers can use their skills and knowledge to increase efficiency and lower costs. In this way, education can be a powerful tool for reducing poverty and promoting economic development."
65CC82C9B3C9,"I I agree because people should have more time to rest mostly because the effect of the stress and the health of their body. Schools should be the same, they could have more time to do their homework and rest, because there is stress in children. In the majority of middle schoolers and high schoolers there is always stress and preoccupations about grades. Most of high school teenagers stress and worry about colleges if they got in or not. And by taking the four-day weekend we are reserving energy and resources, by not driving cars or motorcycles because of the toxic smoke a vehicle throws to the air we breath.

Sometimes some of the big businesses become of abusive or people's hours to get extra work done. It should be people's decision if they want to stay extra hours if they want to get their work done. People work to live and not live to work they somehow got to look for ways to provide themselves and sometimes their families. If they were to finish their jobs with everything done , they get to go home and be with their families.

Having the time off can be people to catch with work if they are behind or for teenagers to catch up with homeworks. School sometimes can be exhausting because some people could be depressed or stressed out to get their things done. Everyone can run out of energy especially when everybody expects for you to do good. Every single member of your family is always telling you to do good just to get things in life is very stressful. Working hard through four days it is more then enough to get work done if you put your mind to it.

People need the extra time to relax, because it is not good for the body mentally and physically. Working too much causes stress and grueling because thinking too much about work and worrying about the bills that they have to pay. By being worried too much can even cause you to go to the hospital so it would be not be good for your health. When you think about the things you have to do to support yourself you have to put yourmind to it and not slack if you want that advantage of thedays you are going to have work.

In conclusions I agree because people should have more time to relax and not stressed about their jobs and what they have to do. People get exhausted and start to worry about all of their responsabilities they have to do. Working for 10 hours is more then enough for a person. Sometimes teeagers and adults carry many preoccupations that they shouldn't worry about but they have to if it envolves them. Schools should be the same and not be so stressful, it could be dangerous to stress and not sleep because they worry about the responsabilities that have to be done.","
    Task: Write an essay on the benefits of taking a four-day weekend for people's mental and physical health. Discuss how this could be beneficial for schools and the environment, as well as employers and employees.","
Taking a four-day weekend can have a positive impact on both mental and physical health. Researchers have found that taking a break, even for a few days, can help to refuel and refresh the mind and body. For one, having an extended weekend can help to reduce stress levels from the daily pressures of work and life. This can help to restore a feeling of calm and balance which can be beneficial for physical health. Moreover, having the extra day can allow us to engage in activities we don’t otherwise have time for such as socializing with family and friends, taking the time to relax, or doing something for self-care. 

Furthermore, having a four-day weekend can have many benefits for schools, the environment, employers, and employees. For schools, it could grant students an additional day to get organized, study, or attend tutoring. Additionally, it could provide a unique opportunity for field trips or use the day for special programming. For the environment, having an extra day off could reduce fossil fuel emissions and lead to a cleaner environment. Employers and employees could also benefit from having the extra day to rest and recoup. Additionally, employers might be able to save on operational costs if the business is closed for the additional day. 

In conclusion, taking a four-day weekend can be beneficial for overall mental and physical health, schools, the environment, employers, and employees. "
65DBDD75CA50,"Jonh once said, Technology had positive and negative effects on people's life, people complete many tasks without having contact with others. Some people said that technology is good because they can do many thinks, like find books, information and do works more easy. Other people thinks differents, they said that technology is bad because had negative effects on people life, if people do not know how to use it, they can will have problems because sometimes people send archivements or informations to the wrong person or publish it. I think that technology is bad because with technology we can do many thinks, but some people use technology for hacks, steal acounts and cheat persons.

First, some people said that the technology is important in this era, because is more easy to do many thinks,

for example, search specific information more fast.

To do homeworks or company works with more information and explanations make projects, glide planes or to find books and work without think a lot.

Second,the technology is very important to some people, because many times they used it to do they works and make some project, the technology in this era provoked many wrong thinks, it created many electronic thinks that are advanced. Then, the purpose of use technology if for good reasons and with the technology always people will have easy infornation but they wil not learn the technology caused that people lose their time playing videos games and visiting wrongs wed site. However, the technology caused many problems, the people are using the electronic thinks a lot, the cellphone, video games etc. It are creating a obsession in the people, many kids and adolocents have problems with they vision, because pass a lot of time in the cell phone, computer or playing videos games causing cancer, tumor or lose their vision.

Finally, the obsession that technology are creating is very worrying, many kids don't do the homeworks, the students text in class and do not put attention, other persons driving texting causing accidents. Some parents permit that they kids use technology, but they do not have the contol of them the adolecents use technology for have fun sometimes causing problems. Today in this era the technology are advancing and provoking that people do not learn and sometimes it cause the death, persons use technology sometimes to hacks acounts and steal informations, photos or they publish inappropriate photos in they acounts causing bullyng or making the person feels bad. Also, the technology is very advance that the people are creating robot to make more easy the works, but is is a ploblem because the robot will be remove the people jobs, causing that the people leaving whithout job.

In conclusion, the technology had negative effects on people's life, creating obsession on people and doing more easy the ability to do works,but for people tha use technology a lot need to have a limit, and if they have acounts with important information they need to protect it with a strong password, if they have kids and permit that use technology they need to control them what they do and put a limit how much can use the computer, cell phone or videos games. people have to put their own limit to control technology when it cause problems.","
Task: Research the effects of technology on people's lives. Investigate positive and negative aspects of technology, and how it can influence people's health, personal relationships, and professional success. Analyze how people can use technology responsibly and limit its negative impacts.","
Technology has become an integral part of our lives, both in the workplace and in our personal lives. While the advances made possible by technology have been beneficial for many, they have also made it easier for us to become over-reliant on digital resources and lose our natural connection with people and our environment.

One of the biggest dangers of technology is its potential to negatively affect our physical and mental health. Prolonged exposure to blue light emitted by electronic devices can disrupt our natural circadian rhythms, causing a range of issues including insomnia, fatigue, and mood disturbances. Additionally, too much time spent on devices is linked to an increase in feelings of depression, anxiety, and stress.

Technology can also impact our personal relationships. The prevalence of social media sites and messaging apps has given our phone screens priority over in-person interactions, preventing us from developing deeper connections with those closest to us.

Fortunately, technology does have the potential to be used responsibly. Limiting our exposure to blue light by avoiding screens at night, and keeping dedicated tech-free time is one way to ensure technology has limited negative impacts. Additionally, setting boundaries for yourself with regard to social media use can help foster healthier relationships. By recognizing the potential risks of technology and taking steps to mitigate them, we can ensure technology continues to be an asset to our lives."
66133AC6189A,"On my experiences I think It would be impossible to change the first impressions becuase one different people have different types of characteristics traits. For example one of my friend who move to text,her characteristic traits I remember she was so nice to everybody when she use to live her in virginia and also she use to get along with everbody at the school. This shows that type of impressions that my friend Generic_Name has.

Another example is when I was in lunch line with my friend Generic_Name,a spanish girl touch my hair,I did not know that girl was the girlfriend of the boy that was in one of my class. Until then when I was going to my third class I ask that boy if he could help me find this class because I did not know where all my classes were,when he came up to me to explain the schuedule and told me and him had the same class,his girlfriend look at me mad. This shows that at first the girl of the boy was nice and then the girl of the boy was kind of mean to mean.

Last example everbody has different types of impressions,it could be in a good way or bad way. Sometimes people impressions might change or they might still be the same.","
Task: Research and decide if first impressions are difficult to change and provide examples.","
First impressions, the initial evaluation of another person or situation, are frequently believed to be highly influential and resistant to change. Many studies have found that people are heavily biased toward initial impressions; once formed, they are difficult to alter.  For example, in the business world, an individual's first impression is often used as the basis for long-term judgements about their personality and capabilities. Also, research has consistently shown that hiring decisions are strongly influenced by first impressions – a candidate's interview appearance, mannerisms, and written resume usually play a major role in the ultimate xdecision. Overall, it is clear that first impressions often make a lasting impact, and can be difficult to undo."
