id,text,instructions,source_text
63AB7F39EBC6,"I disagree , because it's true the firts impression in a personis the most important when knowing a other's.

As humans depends of other's for the survivor;our's characteristics are for genetic of it's way. For this to treat the way of to attach in a group of people.

some people thinking that no it's neccesary because,no we depends of the opinion of he people or the world,for the opponent each person have the different way of interact ,each person have an different way of think,personality,character,and the way of to act. The stereotype's of the society of base in the system of that eachperson of the world is different not all aresame and that each individual have are world,the place were they it felling better and comfortable. Respect the opinion and the intimacy of the people.

In exchange of other people have an idea different...in a new job,in the university,and place's important's of any place;we obligation of the respectful and amiability. The people have the capacity to be good and refined,the impression of the people duty of be always of the better.

A manager to the to contract a people have that to see the personality of are people for know that is the person the found for the place of work.

In my opinion,I believed that all having different way's of tobe. And depends of as to trat a the other's people...We are people that wrong,in a household where are teachen valuesy where are teachen that our's impression duty to be the most important ,but not impressing the first time is the better. Something we do it error's but learn a change and a be different,change the bad things that did. Can change;maybe no now but with the time and us way of thinking,we having the possible of do.

Generic_Name have a different personality,and character,I think that my character no it's the best for it reason I need change not a everyone know this part of me,but i know that my impression depend of my values and my decision of be better. In the society that I to found ,I know my impression not a all people to it to gratify but duty dependencyof be better and that my impression depend of me and not of the other people.

In conclusion , the impression and the actual society;it's important in different factor's: the job,the school and place where I found ,but duty understood that allare different's ans somethingwe do mistakes and something wea have bad day;s ans our's characters not are a good impression,but I can change ,are humans and to do mistakes but the better that can do as humans is accept us mistake and change.","
    
Task: Write an essay disagreeing with the idea that one's first impression is the most important when getting to know someone else.","
My first impression of someone may not be particularly accurate. Societal norms and expectations, personal biases, or even the way someone is dressed can all affect our initial opinion. It is impossible to get a full perspective of someone’s character, personality, or values just by first impressions. People can be much more complex than we give them credit for, and sometimes it takes a second, or even a third, look to get a better idea of who they are. 

Although first impressions can be helpful in some situations, forming too strong of an opinion or judgement based off of minimal information can be hazardous. People should take their own time in getting to know someone's decency, intelligence, and overall character before assuming they shaped the complete, accurate picture. 

Overall, it is a mistake to think that our first impressions are the most important when getting to know somebody. We should leave room for change, understanding, and growth in getting to know someone, and not rely solely on surface-level features."
63BAE4B3ADDA,"Being yourself in a world that wants you to be something else is a great feeling but it takes time to be happy for a example,your parents want you to be a doctor or a lawyer but you want to be a rapper or dancer but you don't know how to tell them because you think they would would be disappointed.

would you want to make your parents to feel disappointed,ll give another example people who like the same sex, theirs been so many stories an articles of people dying because their expressing them selves a lot of people are scared so they don't tell anyone so they become depressed they use a lot drugs to lose the pain but nothing ever works.

In my opinion i agree with Ralphh Waldo Emerson it's a amazing feeling to be yourself and not follow other people because at the end of the day you need to be doing things that make you happy not for other,your priories come first be who ever you want to be like and who ever you want you live one life.","
Task: Write an essay about the importance of being true to yourself despite pressure from society and expectations of family.","
When faced with the expectations of society and family, it can be easy to lose sight of yourself in the process. In today’s world, it is increasingly important to stay true to yourself, no matter how much pressure is applied. Being true to yourself has the potential to provide numerous benefits, such as improved overall well-being and a sense of personal meaning. 

When you remain true to yourself, even when it conflicts with external influences, you will be able to feel more confident and in control of your life. You will find yourself surrounded by people that accept and respect you for who you are. You will find that when you stand up for yourself and refuse to compromise who you are for the sake of others, you will experience a newfound sense of self-empowerment. 

It is understandable to feel caught between the expectations of society and family. It can be overwhelming to know that you're constantly being judged and pressurized. The choices we make in such situations can be difficult, but it is important to remember that in the end, your sense of self is what really matters. If you stay true to your identity and goals in life, you will be able to live your best life. 

So take a stand and stay true to yourself. When you say “no” to outside expectations and pressures, you will gain social and personal empowerment, and eventually, self-confidence. True happiness and a sense of purpose will follow."
63C74FF7DB27,"Take learning distance on home is not good ideas . first reason is not the same to take on school. when we going schools we have more option to learning. sometime when we don't undertant something we can ask the teacher for helping or they can explain many times. But sometimes we have to take the classes on home. for example if you are sick or have a spcific reason that you can going schools is necesary take online because if we whant to learn is the matter we we have to take the classes. the important thing is that we have the energy to continues with your goals.

The Learnig distance on home some time be helping to be more possitive and focud because we can take the clases any hours we can. Also when we cut the clases on home we have more chance to listining. The other option to take the clases on home is that we can do other things that we whant.

Some schools give the chance to often the clasas on home that is great ideas. but sometimes is really important to going schools beacuse when we going schools we have more chance to take more clases and graduated with the other student. Also take clases for video conferencing or going school is little similar becuaser we can see the teacher that is explain the clases. That uniquet things is we can not ask the teacher for helping.

In conclusion. To be attend on schools is more important and helping more tham the distance learning or video conferencing. On my posisition attend on schools is more necesary because we have more opportunity to learm and continues to do the things that we whant.  ","
Task: Compare and contrast distance learning and attending classes at school. Provide examples for support and a conclusion.","
Distance learning and attending classes at school both have their benefits and drawbacks.  Distance learning, such as online coursework, can allow for more flexibility in terms of when and where instruction is completed. It can also allow students to engage with course material on their own terms, taking more or less time as needed for understanding. However, online courses are often more self-directed, and as such may require that students have strong self-discipline or adequate support to ensure that the material is correctly completed.

Attending classes at school still offers its advantages, such as personal engagement with teachers and peers, as well as having fixed end-points to curriculum: namely semesters or quarters. In the classroom, teachers are available to help guide students with any issues they encounter, and the structure of the classroom serves to facilitate focus on mastering material. That said, the physical limitations of attending classes can also paint a challenge for students who have to work around a set school schedule, and who may not always be able to attend or complete their coursework in-person.

In conclusion, there are advantages and drawbacks to each system of learning—distance learning can offer more freedom in terms of when and how to engage with course material, while attending classes can offer more structure and personal connection with a teacher. Ultimately, the choice of system may depend on an individual's personal needs and learning style."
63E2278271E4,"The British john Lubbock wrote 'your character will be what you yourself choose to make it'

there for is a bit concerning about how kids change there characters just because they dont fell good about them selves and have a lot of thinking inside of them the traits that you carry will have a dominance over them but i dont think that its best answering the question there for do actually they take control beyond our control.

There for it will be not always the case between how other view your things and traits makes you in insecure how other people see you and you change to make your self better than our parents gave us something we just got it from society like there is a lot of influences in the internet and more things that can go far behind the imaginable and they are not controlled by anyone they are just more likely to have more influences beyond there control but there is a lot of influences in this world you just got to find the right one for you and stick with it general likely there is more change in society for different perspectives.

Secondly there is a possible out come that you everyone can get out of this, just like other people that change there perspective at looking at things there for i should say that i have changed a lot since i got here in Virginia and am adapting to being normal well the normal way of being normal for other people there are influences beyond our control because what you see on the internet you will want to mimic it one day like there is a lot of rapers talking about 'girls, god there is a it of are influences in our daily lives always hearing what a rapper did or what type of things he is going to do there for its a bit concerning about all that because for a person that just moved here is a lot of change there is a lot of people that influence almost all the world in California there is where i lived all the artist and musical players and all of them have a purpose of having more people being influenced by them and making a lot of money if they get a lot of attention from a lot of people.

There is kids just like adults that get influence by others there is a possibility that we choose our own ideas of being influenced that are out of our control we choose to be this way we choose our path always they follow what we want there for i am proud of the world we live in.

There is a posibility that new things come out every year new things that 'kill' us or maybe other things like war and most of the things happening to our world and more polution and more virus that want to kill us and it is being more influenced by others to be scared of it becasuse you could die from that there is a lot of thinnking behind every smart influences.

Have a nice day, that is what makes us movie froward every time that we get stuck. ","
Task: Compare and contrast different influences that shape individuals' characters and how these influences may be outside of our control. Determine whether it is possible for people to choose their own path, and discuss your opinion of the world we live in.","
Our characters are shaped by a variety of influences, both external and internal. We are influenced by the people we interact with and the environment around us, as well as by our own personal thoughts and feelings. These influences are often outside of our control, and can profoundly affect our development. Even our genetics and upbringing can shape who we become, something we have no control over. Despite this, I still believe that it is possible for people to choose their own path if they are determined enough to do so. There are countless examples of individuals who have overcome difficult situations and created lives for themselves that exemplify strength and perseverance. This brings me hope for our world today, and while some aspects may seem dire, I have faith that we can create a better future if we can strive to do better and be the change we wish to see."
6418C102917D,"In cartoon sponge bob square pants sponge bob he say's "" imagination"" as to us is inferring for us to use our imagination, like no matter how old you are what disabilities you have is inferring to everyone ,But do you ever think imagination is important than knowledge?

Beginning,with this statement i agree because, when we were young little kids we would always imagine that was our big thing like, as an other parent would probably say to your child "" your child has a big imagination "". And imagination will always be apart of us we grew up having our little or big imagination's how do you think we would imagine us in the future or like some other examples: how we want to wear out clothes, what type of clothes we wanna wear, what design we want on our cake, or and how we imagine unicorns, ninjas,or any of those type of things ,and superheros. without imagination we wouldnt know about that or the sense of knowing what that is.

Also,

having imagination is also good because were not always gonna use our knowledge like for disable people not all of them have knowledge or even know what that is,for one example blind people yeah they have knowledge but also in there life they use there imagination throughout a blind person's life imagination is something they will use in there life spam and you wanna know why how do you think blind people know what a teacher is talking about or how they are drawing it blind people use there imagination they use it so they can understand what the teacher is doing or when there walking down the street or when buying clothes,There number one thing there gonna always use is imagination knowledge might also help because you have some information about it or do they just magically know what there doing no they imagine it,or they imagine were this thing is or that thing.

In conclusion, i agree with this statement "" imagination is more important than knowledge "" because for those given reasons like the one about us as kids we would use our imagination and how we would use it for ourselves and the other given example for the blind people how they have that throughout there life spam. therefore those are my reasons i agree with the given statement.","
Task: Write an essay exploring why imagination is more important than knowledge. Consider examples such as when children use their imagination, or how the blind are able to rely on imagination.","

Imagination can provide a solution to the unanswerable, can turn obstacles into opportunities, and can create a path where none existed before. Imagination is essential, both in our personal as well as our professional lives, because it enables us to cast aside the limits of knowledge and see the bigger picture.

Take, for instance, a young child. Children are able to use their imagination in amazing ways, to conjure up stories, pictures or objects of their own making. Parents and educators often praise this sort of creative thinking, as it allows the child to take risks free from the anxiety of being wrong. 

More importantly, imagination can be used to bridge gaps for the differently-abled. For the blind, for example, it is not knowledge that might help a person find his or her way, but rather the ability to imagine one's surroundings. It is imagination that allows them to visualise a street corner or a store, and to traverse a path that may have been previously unknown. 

In conclusion, imagination is considered more important than knowledge because it is far more versatile, powerful, and adaptive. It is the tool we need when knowledge fails us; it is the key to creative thinking; and it allows for a measure of flexibility and creativity that knowledge alone cannot offer."
6422237D967F,"Would you like someone deciding what's best for you or take matter into your own hands? Well in my opinion people should make there own decisions because they can decide how they want things and what makes them happy in there own way even though some would argue that, people should seek guidance from experts and authorities because some times they know whats best for us and our own health. Yes, sometimes when you seek for guidance they help you out a lot and lead you to the right path. They also, help you find whats happy but its not like if your doing it because you want your just doing it to better yourself and your not doing what you want your doing what your told.

Deciding what u want probably is what's best since your going at your own paste, your taking it how you want. your going at your own paste with things. Also, no one can stop you from doing what you believe is best for you. You can find your own ways to cope with things without anyone telling you other wise. Going at your own pace is better then getting rushed, doing what you dont want, and doing what your told even. However, getting help pushes you to do it better.

Seeking guidance isnt bad at all either you get the help you need, you get that push forward to bettering yourself. Sometimes in life there are moments where your not your best help and you need a hand. Theres nothing ever wrong with getting a little help. You sometimes need a hand to understand your values to get to recognize them and meet them.

we all have different life matters because we all dont care about the same thing. we all care about different things. your life important matters are valuable and there something that only you can decide on not any one else. Sure, our values all are different in every type of way thats the reason to why we should decide on our own why our life matters are important. thats why in my opinion people should make there own decisions, find out there matters, what there good at and what the things that they value are.","
Task:
1. Research the potential benefits of seeking professional guidance versus making your own decisions.
2. List the values and life matters most important to you and why. 
3. Write a comparison between making your own decisions and seeking guidance from experts.
4. Summarize why making your own decisions is important for you and why.","
When it comes to making decisions, many of us grapple with the question of whether to go it alone or to seek guidance from those more experienced.  On the one hand, seeking professional advice can provide us with the specialized expertise necessary to tackle complicated situations.  On the other hand, making one’s own decisions can provide a sense of independence and self-ownership.  

For me, I value both my liberty and security.  I value my freedom to be independent and make decisions that reflect my own interests, and I also recognize the importance of maintaining a sense of safety and stability. As such, it’s important for me to strike a balance between trusting my instincts and trusting the wisdom of experts.

Making one’s own decisions is particularly important when it comes to matters of personal values.  No one knows me better than I know myself, so I’m well aware of the values and life matters that are most important to me.  With that being said, when it comes to more complicated or technical matters, I believe it's wise to seek counsel from professionals to ensure I make the best possible decisions.

In the end, it's up to me to choose between making my own decisions or seeking expert guidance.  Ultimately, whether I decide to go it alone or take advantage of the wisdom of others, I am responsible for the outcome.  That's why, in the end, I must always trust my own instincts and values when making decisions that will impact my life."
642CB997325C,"Working Beyond

Do you need to work beyond what you have mastered to grow? Unless you try to do something beyond what you have already mastered, you will never grow. Not everyone agrees that a person can grow after they have already done what they needed. However I agree because people grow by trying new things, people succeed by trying new things, and gain more experience.

Many people grow by trying new things. When people work beyond what they know they try new things. Trying new things can help them grow in many ways. People who try new things may know their job better and work harder. In addition people will get better at what they do. They will have more experience then others and know their surroundings.

Many people may succeed when they try new things. People will become more successful. They will know what has to be done and what does not because they have worked hard and know better. In addition they will know their way around. They will not need much help because they have done the work and grew to be better.

Finally people gain more experience. When people work beyond they will be more experienced. They will have more experience then others and help others when they need the help. People will be more educated in that topic and help others.

While many people think you can not grow. There are a lot of people who are probably growing because they went beyond to learn. Unless you do not do something beyond what you have already mastered, you will never grow.

In conclusion people who go above and beyond grow because they have done more to help them grow and become better and to succeed. You should try and go beyond and see if you grown.             ","
Task: Research the benefits of working beyond what has already been mastered in order to grow and become more successful.","
Pushing yourself beyond your current level of mastery is essential to achieving true success. When you take the initiative to go beyond a skill already mastered, you open yourself up to new opportunities, gain new perspectives, and build a portfolio of experiences that can help you stand out from the crowd. With each challenge successfully completed, you gain a greater understanding of yourself, strengthen your existing skills, and develop new ones. There is no way to move forward without taking risks, and the only way to expand your boundaries and find new success is by taking the initiative to research and try something new and difficult."
