id,text,instructions,source_text
6060D28C05B6,"Some schools in United States ofter classes from home because is good option to students . Some school have decreased bullying and high and middle school because some students get bullied. Students don't want to go more at school and they want to get classes at home. If they get classes at home they don't learning. Some Schools offter distance learning as an option for students to attend classes from home by way of online or video conferencing. students get distract at home. Students get fall in environment learning. Students feel more pressure at home. But students can get relaxing at home.

Students can get distract at home because they have easy to use phones. They feel more bored at home because they need stay at home more time. Also students don't do anything at home because if they stay at home is esay to get more distract. If students sleep in class they want to sleep at home too. Many students work and they would tired and they don't want to learn.

Students don't pay attention in class they too don't pay attention at home because is more hard. Also they want to listening to music or play.

Students fall in environment learning because they learn at class when the teacher explain if students attend classes from home by online is hard they learn. Students can ncreased to learn at home. Also is more hard to students understand by online. Also many students have hard time in class to understand that teacher explain in more hard they learn at home.

Some schools affter classes from home because they think is good option to students. Also students can stay more relaxing from home. Students have more time to do homework. Also they feel more comfortable at home. Also they feel safe at home with their family. Also student sleep more and stay with more energy to receive the class by online. But students get more distract stay near the family and they don't want to pay attention.

Conclude if students get classes from home by online they don't want to pay attention because is more easy they get distract. Also they don't want to learn by online. Students can get fall in environment learning and is hard they learn at home. Also they want to play or use phone and not is good option to students get class at home they get distration and decrease to learning. Also students get frustration in class because they don't understand but if they get classes in online they don't learning too because is more hard they learning from home.","
Task: Write a persuasive essay on whether or not classes from home should be offered as an option for students to attend. Describe the advantages and disadvantages of attending classes from home, as well as the effect it may have on learning. Cite examples to support your argument.","
When considering the pros and cons of attending classes from home, there is no doubt that there are a variety of advantages and disadvantages. On the one hand, it eliminates the need for physical attendance to classrooms, reduces the psychology of peer pressure, and eliminates potential health risks resulting from attending crowded places. In addition, students have the opportunity to arrange their learning environment according to their preferences and better manage their own time. On the other hand, there could be a lack of social interaction with classmates, a lack of guidance from instructors, and potential technical issues as well. 

However, in the end, the effect that home-based classes will have on learning is largely dependent on the situation of the student. For example, those who are already motivated to learn and are self-disciplined may reap the full benefits of studying in the comfort of their own home. Conversely, for those who require more interaction and guidance that comes with physical classrooms, a home-based learning style may not be as effective. 

Therefore, when it comes to allowing students the option to attend classes from home, there are intricacies that need to be taken into consideration in order to ensure that the best decision is made. Ultimately, this decision will depend on the individual student and their ability to take advantage of the opportunities available to them."
60623DB5DE7A,"Four-day work week, a remarkable idea to conserve energy and resources, some businesses have adopted the idea of a four-day work week, with each day consisting of ten hours. I think this idea is amazing, workers would have a day off and they won't be wasting energy and resources like in a regular day of work. Therefore i think my school should follow this model and extend the school day two hours in a four-day school week. Students would be happy of having a day off, and most of them would support the idea of having a four-day school week. By following this idea, my school would conserve energy and a lot of resources such as papers, school materials, food, etc.

A four-day school week benefit students and teachers in many ways, students would have a day off and time to do extra curricular activities such as sports or work, teachers would be at home and have time to spend with their kids and be with the family, and all of us would be conserving energy and resources. One disadvantage of having a four-day school week is that some parents work 5 days a week in different companies and these companies might not have the four-day work week so they won't have time to be with their kids at home in the day off, and some of them would be forced to change their five-day work week to a four-day work week, so they can be with their kids at home.

Personally, i would prefer the four-day school week, because,i have a part-time job after school , it is from 5 to 10pm, and having a day off would allow me to have time to do some extra work at home and to change my schedule for in the morning so i can have the rest of the day to work on my stuffs, have time to chill, or maybe to do my homework, and help my mom with whatever she needs.

Having a four-day school week, would let me have time to do a lot of things during the day, for example, babysit my little brother if my mom goes out, go to the gym or maybe help my dad. I can get another job to work on the weekends, the thing is that it would allow me to be busy, and to generate money.

In my family, my dad is the one who is always at work, he works from 8am to 6pm everyday, he doesn't have a day off, but it is okay for him. My mom, she doesn't work, she is always at home taking care of me and my little brother, for my parents, it wouldn't be a problem for me to have four days of school a week, because my mom would take care of me during that day off.

In conclusion, i think having a four-day school week, would benefit a lot of people, because just like me, there are plenty of students that would love to work more and generate money, and for the teachers, well they would enjoy have a day off and spend time with their kids at home.","
Task: Research the advantages and disadvantages of a four-day school week and write an essay to determine if this model should be implemented at a school.","
One of the primary arguments for implementing a four-day school week is the potential cost savings. Many schools are currently operating at a budget deficit and a four-day week could help those districts by reducing the amount of money spent on utilities, staff, and transportation. Additionally, students would also be provided with an extended weekend, reducing the amount of stress they experience during the week. 

However, there are several potential drawbacks as well. For instance, students may struggle to stay motivated and focused with the extra day off. Furthermore, a four-day school week may also increase the likelihood of teachers needing to miss class and disrupt lesson plans. Additionally, it may be difficult to plan certain events such as field trips, sports games, and Parent-Teacher Conferences. 

Ultimately, while a four-day school week may have some benefits, a thorough assessment of both the advantages and disadvantages must be taken into consideration before implementing it at a school. It is important to weigh both the potential cost savings and the potential negative effects of such a schedule in order to make an informed decision."
607A39D981DE,"Students and their families should consider any activitie that they want to get involved in school before getting in. If students get involve in many of them, then they will not have time to do any of their work from school. Not doing work from school will affect their grades , and they also won't be able to participate anymore, for having bad grades. Parents as being the ones giving permission to the student, should talk to the school and ask if it is posible for their kid to not participate in all of them because of the time, and other responsabilities they have.

First of all students should talk to their parents before taking any desicion, them both need to consider that if the student gets involved in many activities, then they will not have time to do any work from school.

If the students spend too much time on the activities, then he/she would not have time for them other responsabilities. The school should make an runion for parents, so they can agree on the terms that the school want. Activities at school should not be controling, or making the students join so many activities.

If the student does not do the school work, then they will have bad grades, that will affect them by not being able to participate anymore in any of the school actiities. Students should not be able to participate in more than two activities at school. because they will get tired a lot, and therefore they will not do their homeworks. Participating in any of the activities should also be a credit for the students.

Schools are responsable for any activite that it is happening in school, they should contact parents, and also have a reunion, so they would get the parents opinions. Parents as being the ones giving permission to the students, should considered any type of activitie that the student wants to get involved in. Participating in school it is good for students, but not when they do extraactivities.

Some of the activities should be reunating with the students after school, and help them with any questio they have, or repasing anything that they didn't understand in the class.

I think Schools should not control students involvents.

Parents should be the ones desiding, and analizing before allowing their kids join any type of activitie in school. Students should not be able to participate in too many activities that would effect their grades. parents and school should agree on the desicions of wha is going to be better for the students. When students are responsible with their shool work, and their activities, they should get extra credit.      ","
Task: 

1. Talk to your parents before taking any decision regarding getting involved in school activities 
2. Consider how much time you will have to spend on activities and other responsibilities
3. Know that if you take too many activities on, you will not have enough time doing school work, which would result in bad grades
4. Have a meeting with the school to discuss the extracurricular activities and get parents’ opinions 
5. Make sure that activities","
Before making any decisions about getting involved in school activities, it is important to consult with your parents and have a clear understanding of how much time you can realistically dedicate to them. Participating in too many activities can impact your ability to focus on school work, which could result in poor grades. To ensure that parents are comfortable with the amount of activities that you are considering, have a meeting with the school to discuss the extracurricular activities and get parental feedback. Once everyone is on board, you can decide what activities are right for you, while keeping in mind your current workload."
60ACDFA1609E,"Agree you will never grow if something beyond of what you have mastered. However, some people believe that you don't have to do this to grow that you can grow conform the time. Emerson's was right with this quote people have think more then just of what they believe, if they grow they will achieve their dreams if they achieve they will grow you just have to believe in what you are.

Unless you try to do something respect, you have to do the best of you if you want to grow. Base in my experiences I'm growing, I try hard, and I try to convince the other do to the same, we want a better world we students to grow if they grow this will be a proud for the others. If we don't an open mind this will be the opposite we will never grow,no matter what is happening he we have to grow.

At the end of all of this we will have something do where we can be support our live, always come something better, you have to be organize with your things. The idea is to be your self don't ever let other people to control you just be you, and the decision is on you.

Don't you ever be an a position to where you have to decide between to options? That's when you to believe in yourself, to thing want your want to be grow or stay in the floor. If you grow will be more opportunities for you and maybe don't just for you can be for the others who are around of you.

Give the best of you to make it, for example if you don't try to grow what will be of you what kind of person you will be.

There are benefits to grow like you can be a person who can do almost all the things ,you can be accept or be sociable. Emerson gave us a great point with this statement we have to appreciate of what he wrote in my view he completeright about to try something beyond what you have already, just try and you can make it.","
Task: Write an essay discussing the benefits of pushing yourself beyond what you have already mastered in order to grow and achieve your dreams. Use Emerson's quote as a starting point and back it up by citing real life examples from your own experiences.","
Ralph Waldo Emerson once said, ""Go confidently in the direction of your dreams! Live the life you’ve imagined"". These inspiring words provide a valuable insight into the importance of pushing ourselves to strive for more in life. By pushing ourselves to push beyond our current level of mastery, there is more potential to grow and achieve our wildest dreams.

I have had many experiences in my life affirming this notion, particularly with regards to educational achievements. During my university years, I was often in situations where I had to push myself beyond what I knew I could do in order to get a desired result. For example, I recall a time when I had to work extra hard to manage a difficult assignment in a short time-frame. With a focused mindset and a strong work ethic, I surpassed my own expectations. In the end, I achieved a grade that I was proud of and as a result, I felt a great sense of accomplishment and growth.

Overall, pushing ourselves beyond what we have already mastered provides an invaluable opportunity to learn, experience, and create something that we may have thought was an impossibility. As Emerson said, by going confidently in the direction of our dreams, we are giving ourselves a chance to realize our full potential and to achieve amazing feats."
60AE13D3F07B,"I think our character traits are formed by influences beyond our control. Everybody has a different character trait and I believe it is formed by our parents, brothers, or sisters. It is the responsibility of adults to teach their child how to behave and that is usually how their traits are formed. As children begin to go to school, most often they meet other kids and become friends. Friends also have an influence on how traits are formed like for example: Kindness, friendly, honest, and more. The influence mainly comes from parents and are the role models for their children. Our character traits are formed by influences. Many people around the world have different character traits, Everyone is different on the way they behave around others. Therefore they are formed. My character traits are quiet, funny, and calm. These traits for formed because of school and my friends. John Lubock mentions that ""your character will be what you yourself choose to make it."" I think that this quote explains that you are able to choose it by yourself. I disagree and I believe that other humans make our character traits.","
Task: Research and discuss how character traits are formed in humans, paying particular attention to the influence of parents, siblings, friends, and school.","
Human character traits are shaped by a wide range of influences. Most notably, the early influences of parents, siblings, friends, and school can greatly impact the development of a person’s character traits. Parents, for example, can have a major influence on a child’s moral compass by providing consistent guidance and setting a positive example of how to act and treat others. Siblings can also be powerful models of behavior that have a significant impact on the development of character traits, particularly in the areas of cooperation, communication, and leadership. Friends can offer insights to beliefs, values, and lifestyles that can influence a person’s character traits. And, of course, schools can provide opportunities for academic growth, as well as the potential for exploring different intellectual pursuits, developing social skills, understanding cultural norms, and engaging in activities that can shape a person’s character traits. All of these influences serve to form and inform a person’s character traits, and so a better understanding of them can be advantageous."
60AEEA05E1A9,"Online classes, i think that if students really trying to learn something is not need for them to take classes online but sometimes, teachers cannot teach al the students well because is only 1 teacher and like 30 students in every class room, and i think that online classes are not a bad idea because they been teach by a computer and they have to pay attention or they will fail, but at school they wont fail that easy because they can get copy from another students and thats how they will pass classes better at school then online .

Now lets really talk about online classes, is a perfect solution for students that for some reason they cant go to school in case that they had a car accident they cant walk but they parents dont want them to fail the school year , or they dont feel like going to school thats why online classes are the best choice not only for me for a lot of people like student and parents; I mean school is not that bad at school students can make more and more friends every year online they will get tired if they have to see the same computer and hear the same voice everyday.","
Task: Write an essay exploring the pros and cons of online classes, considering factors such as student engagement, difficulty of passing, and student-teacher relationships.","
Online classes have been increasingly popular as technology advances and the need for social distancing increases. There are several advantages and disadvantages to taking courses online. One pro is that online classes can be taken at any time and from any location, making them more accessible to people who have difficulty attending a standard class. There is also evidence that online classes can foster student engagement as students are in control of when and how they access their education. Additionally, online classes make it easier for students to collaborate and communicate with one another in discussion forums or chat rooms. 

On the other hand, there are several drawbacks to taking online classes. It can be difficult for students to motivate themselves when there is no professor present and no regular deadlines and expectations. Online classes also often lack the personal connections and relationships that come from face-to-face instruction. Furthermore, several studies have shown that students tend to be less successful in passing online classes than in traditional classroom courses.

In conclusion, while there are some advantages to taking online classes, there are also disadvantages to consider. Ultimately, the decision of whether or not to take online classes should be made on an individual basis, taking into account student engagement, difficulty of passing, and student-teacher relationships."
60CCF0F2DF38,"Dear Winston Churchill,

I strongly believe that, failure plays a huge role in pursuing success, and I have a personal story and also information to back up my statement ""that failing is the key to success"".

The news article of daily life, had a section dedicated to failing is a key to success, in that portion it talks about how the most successful people in the world had to fail so many times and hardship in that portion of the article it interviews Bill Gates and he quote on quote said that ""failing thought me that you have to try harder and harder every time you fail in order to successed"", and without failing he would not be the CEO of Google.

I personally have experienced how failing is the key to success. I started playing football in my freshman year in high school. I was trying so hard to get a starting position on the football team. I was doing really bad during team practice, and one day my coach came up to me and told me that I should quit football, and how it was not the right sport for me. So I got cut from the team but I did not listen to what my coach said to me. I kept practicing over the off season working harder then ever. When sophomore season came up and we had to go through tryouts in order to make the team. I was doing really good in the first two days of the tryouts but then I started doing really bad on the third day, and then the coach came up to me on the last day of the tryouts, and told me that I did not make the team. I started feeling really hopeless but I still did not gave up and kept working harder and harder. On my junior season it was time for the football tryouts once again. I started doing really good, and the coaches were really impressed of what I was capable of doing. Last day of the tryouts the coach came up to me, and told me that he was really proud of me. He was really surprised that I didnt gave up, and after that he told me I made the team as a starting defensive tackle.

In conclusion this is why I strongly agree that failing is a key to success, without failure we as human beings would not be able to improve in our day to day life. It is because of failing which keeps us successful, and makes us humans work harder for what we want in life.

Sincerely,

Generic_Name         ","
Task:
1. Research prominent successful individuals and the role that failure played in their success.
2. Find evidence to support the claim that ""failing is the key to success"".
3. Write a personal story that illustrates how failure has contributed to success.
4. Outline the essay by writing a thesis statement and main points to be included.
5. Draft the essay.
6. Proofread and revise the essay to ensure it conveys the intended message.","
No matter how hard we work or how much ambition and motivation we have, failure is as much a part of success as accomplishments. This is evidenced by the countless prominent successful individuals who have experienced numerous struggles on their path to success. For example, Apple Co-founder Steve Jobs was famously fired from the company he helped build, only to return and lead it to even greater success. His famous quote, “sometimes life hits you in the head with a brick,” serves as a reminder that failure is a necessary challenge to encounter when striving for greater success. 

This essay aims to address how failure can ultimately be a key element to achieving success. By exploring specific real-world examples of prominent successful individuals, exploring the relationship between failure and success, and looking at my own life experiences, I will demonstrate that experiencing failure can be an essential step towards success. 

First, by looking at the lives of prominent successful individuals, we can see the role of failure in their success. From Elon Musk to Oprah Winfrey, there are countless stories of individuals who have failed on their paths to becoming global success stories. And not just small setbacks – individuals like Thomas Edison, for example, demonstrated the huge leaps of progress that can made from grappling with mistakes, which ultimately became the foundation for some of his most impressive accomplishments. 

We can also look at the relationship between failure and success in our own lives. I, for one, have experienced numerous failures while working towards a goal. In particular, while preparing for my college entrance exams, I was faced with many challenges and failed the first few tests. It was not until I looked at the mistakes I made that I could understand what I was doing wrong and make necessary changes in my studying approach. 

In conclusion, it is clear that failure can be a powerful stepping stone to success. Prominent successful individuals serve as examples of how mistakes can lead to great accomplishments. Furthermore, by reflecting on our own life experiences, we can understand the significance of failure in helping us grow and reach our goals. As such, it is crucial to embrace failure in any endeavor in order to reach true success."
