Video ID,Title,PublishDay,PublishDate,PublishTime,Duration(seconds),Likes,ChannelName,SubscriberCount
ToALTV2Tjwg,Link Up TV Talent Hunt (Shepherd's Bush) Hosted By Harry Pinero,Sunday,11/18/2018,16:30:00,759,5951,Link Up TV,2170000
ToALTV2Tjwg,Link Up TV Talent Hunt (Shepherd's Bush) Hosted By Harry Pinero,Sunday,11/18/2018,16:30:00,759,5951,Link Up TV,2170000
mPISCMyzMk8,Link Up TV Talent Hunt (Croydon)  Hosted By Harry Pinero,Sunday,11/25/2018,16:40:42,754,5203,Link Up TV,2170000
mPISCMyzMk8,Link Up TV Talent Hunt (Croydon)  Hosted By Harry Pinero,Sunday,11/25/2018,16:40:42,754,5203,Link Up TV,2170000
84nMlW5_d7Y,Link Up TV Talent Hunt (Brixton) Hosted By Harry Pinero,Sunday,12/2/2018,17:30:01,555,8182,Link Up TV,2170000
102UhkbLeWw,Link Up TV Talent Hunt (Peckham) Hosted By Harry Pinero,Sunday,12/9/2018,18:00:00,721,7398,Link Up TV,2170000
102UhkbLeWw,Link Up TV Talent Hunt (Peckham) Hosted By Harry Pinero,Sunday,12/9/2018,18:00:00,721,7398,Link Up TV,2170000
SV8r6KXLfSE,Link Up TV Talent Hunt (Stratford) Hosted By Harry Pinero | Christmas Special,Tuesday,12/25/2018,18:00:02,851,13025,Link Up TV,2170000
JUn1dDNC7lY,Link Up TV Talent Hunt (Hyde Park) Hosted By Harry Pinero | 420 Special,Sunday,4/28/2019,17:58:15,911,6977,Link Up TV,2170000
JUn1dDNC7lY,Link Up TV Talent Hunt (Hyde Park) Hosted By Harry Pinero | 420 Special,Sunday,4/28/2019,17:58:15,911,6977,Link Up TV,2170000
5Op5FnqyIow,Link Up TV Talent Hunt (Brighton) Hosted By Harry Pinero | Link Up TV,Sunday,5/12/2019,15:58:46,974,5492,Link Up TV,2170000
2Fa1XMFUxL4,"Harry Pinero Talks Girls, Merky Fest and YouTube Throwbacks | GASWORKS",Thursday,6/6/2019,13:58:47,1565,20472,Boiler Room,3880000
F2p1sqk7lsg,Link Up TV Talent Hunt (Cambridge) Hosted By Harry Pinero | Strawberries & Creem Festival Special,Sunday,6/16/2019,20:58:15,1138,11929,Link Up TV,2170000
BbfEQ-rnbEM,"CHUNKZ, FILLY, JACK FOWLER, HARRY PINERO DATE RUBY | Does The Shoe Fit? Season 2 | Episode 1",Wednesday,8/28/2019,18:00:00,764,142458,Footasylum,2710000
q1g1BDfYprg,Run The Mic?€?s ?€?Bag it Up?€? w/Harry Pinero Ep.2 ft Headie One | @MixtapeMadness,Friday,8/30/2019,16:45:01,721,4951,Mixtape Madness,1630000
ztHa9c3D15Y,"CHUNKZ, HARRY PINERO AND JACK FOWLER CRASH FILLY?€?S DATE | Does The Shoe Fit? Season 2 | Episode 3",Wednesday,9/11/2019,18:46:15,694,94356,Footasylum,2710000
bY7W-2HSIvE,"HARRY PINERO, CHUNKZ & YUNG FILLY - BETA SQUAD FC vs AFILLYATES REACTIONS",Sunday,9/15/2019,14:00:45,1516,14548,Pro:Direct Soccer,818000
bY7W-2HSIvE,"HARRY PINERO, CHUNKZ & YUNG FILLY - BETA SQUAD FC vs AFILLYATES REACTIONS",Sunday,9/15/2019,14:00:45,1516,14548,Pro:Direct Soccer,818000
zF6TwnBkH-I,"CHUNKZ GETS A FAKE NUMBER, HARRY RUINS FILLY?€?S DATE | Does The Shoe Fit? Season 2 | Episode 4",Wednesday,9/18/2019,18:00:14,908,169694,Footasylum,2710000
syNaiMVEbJo,"WHO WINS - CHUNKZ, FILLY, HARRY PINERO OR JACK FOWLER? | Does The Shoe Fit? Season 2 | Episode 5",Wednesday,9/25/2019,18:00:06,774,134241,Footasylum,2710000
Ret2SuuAgr0,Run The Mic?€?s ?€?Bag it Up?€? w/Harry Pinero Ep.3 ft M Huncho | @MixtapeMadness,Friday,9/27/2019,18:00:04,768,10060,Mixtape Madness,1630000
5t_r8J9uSzM,YUNG FILLY & HARRY PINERO VS LUCAS MOURA | FOOT GOLF CHALLENGE,Thursday,11/7/2019,16:58:19,536,10467,Pro:Direct Soccer,818000
wqKAv5vgk8M,YUNG FILLY & HARRY PINERO ft. KIERAN TIERNEY | PAVEMENT TO PITCH,Friday,11/15/2019,13:00:16,687,9015,Pro:Direct Soccer,818000
1lIXf_hpyVo,Chunkz & Harry Pinero ft. Klopp & Mane - Liverpool Pro Trials Challenge - Win Man?? Signed Boot!!,Wednesday,11/27/2019,16:30:00,691,47111,Pro:Direct Soccer,818000
Yqccp8PUYGk,HARRY PINERO COOKS GIZZARD | CHRISTMAS CHEFASYLUM EP 2,Sunday,12/15/2019,19:00:02,1231,17185,Footasylum,2710000
xo8jFS91VSw,YUNG FILLY AND HARRY PINERO NEARLY FREEZE | ICE BATH CHALLENGE,Monday,12/16/2019,16:30:02,1374,12220,Pro:Direct Soccer,818000
9GySZzz_FwA,CHUNKZ & HARRY PINERO vs TODD CANTWELL | FOOT GOLF CHALLENGE,Friday,2/14/2020,18:30:02,880,8525,Pro:Direct Soccer,818000
5aSnyrmhuTk,???? YUNG FILLY BLINDED BY FOOTBALL! HARRY PINERO & YUNG FILLY ENGLAND FUTSAL TOUCH CHALLENGE,Friday,2/28/2020,16:30:01,824,5556,Pro:Direct Soccer,818000
f3udHqtZVrU,Link Up TV Talent Hunt (Los Angeles) Hosted By Harry Pinero,Sunday,3/8/2020,19:00:11,1653,4609,Link Up TV,2170000
IPaHFau9p4U,"HARRY PINERO, DARKEST AND AJ GUESS THE CELEBRITY",Wednesday,4/1/2020,18:00:06,939,25064,Footasylum,2710000
xK-bVjoQXjk,HARRY PINERO AND AJ MAKE DARKEST DISS TRACK | Higher or Lower EP2,Wednesday,4/8/2020,15:00:36,763,16393,Footasylum,2710000
N2IDoSovAQc,CHUNKZ & HARRY PINERO DO MY VOICEOVER WITH NO MANNERS. they violated me.,Monday,6/1/2020,14:42:50,604,121367,Nella Rose,812000
ekpBNi5GQxM,CHUNKZ AND HARRY PINERO DISCUSS FAMILY AND MANCHESTER UNITED | Think Twice | S2 Ep 1,Sunday,6/28/2020,18:00:13,1309,20182,Footasylum,2710000
-84dsLoZ6yA,CHUNKZ AND HARRY PINERO TALK YOUTUBE MONEY | Think Twice S2 Ep4,Sunday,7/19/2020,18:00:00,1224,15507,Footasylum,2710000
bj4BEh-FsOA,DARKEST AJ AND HARRY PINERO BLINDFOLD FAST FOOD CHALLENGE!!,Sunday,7/26/2020,18:00:08,854,8994,Footasylum,2710000
Am0SzudhvjE,CHUNKZ SMASHES FILLY IN THE FACE (Chunkz Soccer Aid Redemption feat Yung Filly Harry Pinero),Tuesday,9/22/2020,15:45:00,1133,74272,Pro:Direct Soccer,818000
2RnLqVXZjeY,GENERAL KNOWLEDGE QUIZ FORFEITS ft HARRY PINERO,Friday,10/9/2020,18:59:30,1115,187164,Yung Filly,1640000
iX2DDdd9Ukg,"CHUNKZ, FILLY, HARRY PINERO + KONAN ARE BACK | Does The Shoe Fit? Season 4 Episode 1",Sunday,10/18/2020,18:00:08,1013,264700,Footasylum,2710000
sihX9huKayQ,"CHUNKZ SINGS, FILLY CLARTS!! | Does The Shoe Fit? Season 4 Episode 3",Sunday,11/1/2020,19:00:05,899,160644,Footasylum,2710000
hXWqMcKIdvc,'I NEARLY Quit!!' - Harry Pinero aka Playboi Clarti || Halfcast Podcast,Sunday,11/1/2020,12:01:33,3929,2971,Chuckie Online,127000
AJd5qSiz_Vg,"That time, on 90s Baby Show ft Harry Pinero, when temi forgot his height.",Thursday,11/12/2020,16:18:36,23,33,Podcast Central,1430
IoOB38u5SQQ,CHUNKZ AND FILLY GET REJECTED!! WHO WINS? | Does The Shoe Fit? Season 4 | Episode 5,Sunday,11/15/2020,19:00:06,887,202617,Footasylum,2710000
IoOB38u5SQQ,CHUNKZ AND FILLY GET REJECTED!! WHO WINS? | Does The Shoe Fit? Season 4 | Episode 5,Sunday,11/15/2020,19:00:06,887,202617,Footasylum,2710000
dmhIcRKWLH4,GENERAL KNOWLEDGE QUIZ FORFEITS FT HARRY PINERO & DARKEST MAN,Friday,11/20/2020,20:18:21,755,153312,Chunkz,3270000
uK3oRp3vxek,RIDDLES WITH FORFEITS FT CHUNKZ & HARRY PINERO,Sunday,11/22/2020,19:00:42,1004,164475,Darkest Man,620000
1QdEYlNOtlY,"MEAN COMMENTS ARE BACK WITH CHUNKZ, YUNG FILLY & HARRY PINERO",Sunday,11/22/2020,19:00:01,796,118342,Pro:Direct Soccer,818000
_6UqOVKFv3M,ASSUMPTIONS WITH CHUNKZ & DARKEST MAN,Tuesday,11/24/2020,19:00:18,649,90348,Harry Pinero,645000
B_D8WEnDePM,"CHUNKZ, DARKEST AND NELLA ROSE EAT HARRYS GIANT SNAIL!! | Chefasylum S5 Ep1",Sunday,12/6/2020,19:00:01,1281,154324,Footasylum,2710000
SukYEdbWYh8,"CHUNKZ, DARKEST MAN AND NELLA ROSE BEEF!! | Chefasylum S5 Ep 2",Sunday,12/13/2020,19:00:10,1277,89148,Footasylum,2710000
KiWr80N86PY,HESITATIONS WITH CHUNKZ & AJ SHABEEL,Saturday,12/19/2020,19:00:17,682,79979,Harry Pinero,645000
uB9R9D2LwNM,"NELLA COOKS FOR CHUNKZ, DARKEST MAN AND HARRY PINERO!!! | Chefasylum S5 | Ep 3",Sunday,12/20/2020,19:00:26,1302,146861,Footasylum,2710000
RgigIeocM0Y,GENERAL KNOWLEDGE WITH CHUNKZ & DARKEST MAN,Saturday,12/26/2020,20:30:07,796,132450,Harry Pinero,645000
FrKiKey-e6c,SONG ASSOCIATION WITH FORFEITS FT CHUNKZ & HARRY PINERO,Tuesday,12/29/2020,20:01:36,1058,142018,Darkest Man,620000
65f93CsFPYA,MEAN COMMENTS FT DARKEST & HARRY PINERO,Friday,1/22/2021,18:30:21,929,201217,Chunkz,3270000
wZgEklkibN8,"DARKEST MAN, HARRY PINERO and MIKES COMEDY are back! | You Think You Know Music | Episode 1",Sunday,1/31/2021,19:00:23,1235,33446,Footasylum,2710000
KF8I09WBtEI,SIDEMEN TINDER IN REAL LIFE 3,Sunday,2/7/2021,18:02:47,3427,2042284,Sidemen,20700000
3cRx36rPXGo,KNOW YOUR CLUB | FOOTBALL CHALLENGE #2 FT HARRY PINERO,Monday,2/8/2021,17:34:11,775,20114,SDS,254000
3cRx36rPXGo,KNOW YOUR CLUB | FOOTBALL CHALLENGE #2 FT HARRY PINERO,Monday,2/8/2021,17:34:11,775,20114,SDS,254000
Q1rHhhS-FCw,Sidemen Tinder in Real Life 3 but its only HARRY PINERO - Compilation-,Tuesday,2/9/2021,13:33:47,497,Null,Best Of Sidemen And More,17600
Ln45VAQxJhM,"""Mum You?€?re Getting Bottled"" ft Harry Pinero | The Mo Gilligan Podcast",Friday,2/12/2021,13:00:14,5281,5911,Mo Gilligan,162000
nmQCWZqRuAw,DARKEST MAN and HARRY PINERO Road Man Nursery Rhymes! | You Think You Know Music | Episode 3,Sunday,2/14/2021,19:00:20,1051,19655,Footasylum,2710000
EXEc0Q45SMo,EPIC 1V1 RAP BATTLE!! - DARKEST MAN V HARRY PINERO,Friday,2/19/2021,18:00:02,755,276720,Chunkz,3270000
HI-AJA1flWk,GUESS THE LYRIC WITH CHUNKZ & DARKEST MAN,Saturday,2/20/2021,19:10:14,568,88498,Harry Pinero,645000
_RSova6MSmI,"DARKEST MAN, HARRY PINERO AND MIKES COMEDY GUESS THE CELEBRITY!!!",Sunday,2/21/2021,19:00:07,601,25883,Footasylum,2710000
eKAdY_Bufs0,WHATS THAT SONG? WITH FORFEITS FT CHUNKZ AND HARRY PINERO!,Tuesday,2/23/2021,20:29:57,613,125357,Darkest Man,620000
pvczGO_Ln-E,EPIC 1V1 RAP BATTLE!! - DARKEST MAN V HARRY PINERO - REACTION,Tuesday,2/23/2021,22:20:35,1071,1582,Bandwagon BAM,70300
psufA2BobCs,?€?He can?€?t handle an intelligent lady?€?. *Harry Pinero* (Sidemen Sunday Tinder In Real Life 3),Saturday,2/27/2021,10:49:44,28,4978,Dimitris Epeslis,721
HgwLVnwCvBY,GUESS THE ARTIST WITH CHUNKZ & DARKEST MAN,Sunday,3/14/2021,19:00:10,690,66837,Harry Pinero,645000
HOF1RXfOAP8,HARRY HOWLS FOR HELP | CHUNKZ FILLY HARRY PINERO AJ PLAY FLIGHT OR FRIGHT | EP 1,Sunday,3/14/2021,19:00:03,1033,38659,Pro:Direct Soccer,818000
FhIIxuYuX8E,STINGING FORFEITS FOR FILLY | CHUNKZ YUNG FILLY HARRY PINERO AJ PLAY FLIGHT OR FRIGHT | EP 2,Sunday,3/21/2021,19:00:02,827,23326,Pro:Direct Soccer,818000
FhIIxuYuX8E,STINGING FORFEITS FOR FILLY | CHUNKZ YUNG FILLY HARRY PINERO AJ PLAY FLIGHT OR FRIGHT | EP 2,Sunday,3/21/2021,19:00:02,827,23326,Pro:Direct Soccer,818000
LztezNYwRs4,HESITATION WITH FORFEITS FT HARRY PINERO & AJ SHABEEL,Tuesday,3/23/2021,20:36:56,741,62856,Darkest Man,620000
dFbGZcRrB3A,Harry Pinero & Jordy | No Behaviour Podcast EP. 062 | Margs & Loons Ft Harry Pinero & Jordy,Tuesday,3/23/2021,7:52:42,3735,1091,No Behaviour Podcast,37300
4-Ajb3f4VXc,FORFEIT FRENZY FOR AJ I CHUNKZ YUNG FILLY HARRY PINERO AJ PLAY FLIGHT OR FRIGHT | EP 3,Sunday,4/4/2021,18:00:01,1030,16511,Pro:Direct Soccer,818000
4-Ajb3f4VXc,FORFEIT FRENZY FOR AJ I CHUNKZ YUNG FILLY HARRY PINERO AJ PLAY FLIGHT OR FRIGHT | EP 3,Sunday,4/4/2021,18:00:01,1030,16511,Pro:Direct Soccer,818000
shkBvdP3Hx4,THE LAST EVER MEAN COMMENTS?! CHUNKZ & HARRY PINERO,Sunday,5/16/2021,18:00:22,703,86525,Pro:Direct Soccer,818000
h-Lenq6SCsk,CHUNKZ & HARRY PINERO PICK THE ENGLAND TEAM FOR EURO 2020,Sunday,5/23/2021,18:15:00,616,9477,Pro:Direct Soccer,818000
njHcMncO2Gw,"CHUNKZ, HARRY PINERO AND NELLA ROSE DATING ADVICE!!!  | Think Twice | S4 Ep 1",Sunday,5/30/2021,18:00:20,998,38433,Footasylum,2710000
njHcMncO2Gw,"CHUNKZ, HARRY PINERO AND NELLA ROSE DATING ADVICE!!!  | Think Twice | S4 Ep 1",Sunday,5/30/2021,18:00:20,998,38433,Footasylum,2710000
1e3LPRFmRi8,Harry Pinero roasts girl in sidemen tinder,Wednesday,6/16/2021,9:19:47,14,84863,Nel Pawa,533
EQdYBe5gvmA,CHUNKZ AND HARRY PINERO TALK FATHERHOOD NELLA ROSE | Think Twice | S4 Ep 4,Sunday,6/20/2021,18:00:05,1130,24533,Footasylum,2710000
qZP-vTbXIaU,TRANSFORMING HARRY PINERO INTO PAUL POGBA WITH CHUNKZ & HD CUTZ,Tuesday,7/6/2021,18:00:13,358,6774,Pro:Direct Soccer,818000
mq6BbZiN4kI,Harry Pinero's touch???????? #shorts,Thursday,7/8/2021,23:21:59,13,52746,Domclipz,22000
mq6BbZiN4kI,Harry Pinero's touch???????? #shorts,Thursday,7/8/2021,23:21:59,13,52746,Domclipz,22000
1cUmxvqZJP0,CHUNKZ & HARRY PINERO ft. HARRY MAGUIRE | PAVEMENT TO PITCH,Friday,7/9/2021,18:00:02,403,4417,Pro:Direct Soccer,818000
1VfkjtB8mVU,"FILLY, DARKEST AND HARRY PINERO BARBER SHOP (GONE WRONG) | Bad Barber Ep 1",Wednesday,7/21/2021,18:00:01,1240,43651,Footasylum,2710000
XcGqpTC94KY,FILLY SHAVES HEAD BALD!! WITH DARKEST AND HARRY PINERO | Bad Barber Ep 2,Wednesday,7/28/2021,18:00:06,1495,25699,Footasylum,2710000
1PZtynoIK7U,Harry Pinero Funny Moments #1,Monday,8/2/2021,16:14:12,357,4729,WhyzhKakashi,2210
_APkneshVXc,"FILLY, DARKEST AND HARRY PINERO HAIRCUT (FAIL)!!! | Bad Barber Ep 3",Wednesday,8/4/2021,18:00:12,1523,59854,Footasylum,2710000
#NAME?,Untold Stories | Parenthood: ?€?A First Time Father?€? by Harry Pinero,Tuesday,8/10/2021,16:00:01,420,752,Henrie Kwushue,6210
aB0Y-Q7MAA4,"FILLY, DARKEST AND HARRY PINERO THE FINAL HAIRCUTS! | Bad Barber Ep 4",Wednesday,8/11/2021,18:00:00,1166,22708,Footasylum,2710000
7a3XkvIraY0,CHUNKZ & HARRY PINERO BALLERS BARBERS BANTS | PRO:DIRECT THE CUT,Friday,8/13/2021,18:00:02,740,4037,Pro:Direct Soccer,818000
#NAME?,THE FINAL!!! CHUNKZ TESTS DARKEST AND HARRY PINERO'S FRIENDSHIP!! | TruthAsylum | Season 4 EP 4,Sunday,8/22/2021,18:00:01,830,35307,Footasylum,2710000
#NAME?,"$10,000 GUESS THE LYRIC WITH CHUNKZ, AJ SHABEEL & DARKEST MAN",Thursday,8/26/2021,16:00:01,990,93875,Harry Pinero,645000
bUgDwIklnS8,"SPELLING BEE & FREESTYLING WITH FORFEITS FT CHUNKZ,HARRY PINERO AND AJ SHABEEL!!!",Friday,8/27/2021,17:00:27,996,132335,Darkest Man,620000
MEeZMeY0Kuk,HARRY KANE TELLS CHUNKZ & HARRY PINERO BEST SOCCER AID PENALTY SECRETS,Friday,9/3/2021,18:00:12,239,5222,Pro:Direct Soccer,818000
xI9n-9YoagY,"HARRY PINERO MEETS JADON SANCHO, LUKE SHAW AND HARRY MAGUIRE! | Man Utd Assumptions Special",Monday,9/6/2021,15:00:02,796,33231,UMM,181000
qdmPcgahfDA,"Giggs, Burna Boy, Bugzy Malone, DigDat, Harry Pinero & More @ Strawberries & Creem 2021 | Link Up TV",Tuesday,9/28/2021,11:00:17,1641,756,Link Up TV,2170000
fmCfWQ9cNbE,YOUTUBER COOK OFF VS HARRY PINERO!,Saturday,10/16/2021,16:16:53,973,78066,Calfreezy,4190000
UdwkJBZKkY0,Harry Pinero ..VIOLATED???? ft Yung Filly & Chunkz #shorts,Sunday,10/17/2021,17:00:14,61,32279,SIM SIMMA,3710
